{
  "client": "NADAA Ghana",
  "project": "Ghana Emergency Preparedness, Warning & Disaster Response Platform",
  "phase": "Phase 3",
  "sprint": "Sprint 13/14",
  "epic": "EPIC 17: National-Scale Alerting And Operations",
  "story": "National Open Disaster Data Portal",
  "jiraKey": "NADAA-162",
  "branchName": "feature/NADAA-162-open-data-portal",
  "pullRequestUrl": "",
  "status": "Done",
  "assignedTeamMember": "Kimi",
  "estimatedEffortPoints": 13,
  "actualEffortHours": 3,
  "progressPercentage": 100,
  "lastUpdated": "2026-07-10",
  "dependencies": ["NADAA-012", "NADAA-090", "NADAA-100"],
  "blockers": [],
  "verification": [
    "services/open-data-service go test ./...",
    "services/open-data-service go build ./cmd/server",
    "pnpm --filter @nadaa/shared-types typecheck",
    "pnpm --filter @nadaa/citizen-web typecheck and build",
    "OPEN_DATA_SERVICE_URL=http://127.0.0.1:8102/api/v1 pnpm smoke:open-data-portal",
    "pnpm lint",
    "pnpm typecheck",
    "pnpm test",
    "pnpm build",
    "pnpm go:test",
    "pnpm go:lint",
    "pnpm go:vet",
    "pnpm validate:docs",
    "pnpm security:scan",
    "pnpm audit --audit-level high",
    "pnpm exec prettier --check",
    "git diff --check"
  ],
  "notes": "Added services/open-data-service Go API with catalog, detail, rate-limited audited download, access request, and admin review endpoints. Citizen-web Open Data Portal shows category filters, dataset detail with sample data table, download button, and restricted-dataset request form. Shared TypeScript contracts, smoke script, CI Docker matrix entry, README, api.md docs, and plan updates added. Datasets are approved and anonymized/aggregated before public exposure; downloads are rate-limited and audited."
}
