{
  "client": "NADAA Ghana",
  "project": "Ghana Emergency Preparedness, Warning & Disaster Response Platform",
  "phase": "Phase 2",
  "sprint": "Sprint 11",
  "epic": "EPIC 10: Recovery And Logistics",
  "story": "Donation And Aid Coordination",
  "jiraKey": "NADAA-123",
  "branchName": "feature/NADAA-123-donation-and-aid-coordination",
  "pullRequestUrl": "",
  "status": "Done",
  "assignedTeamMember": "Kimi",
  "estimatedEffortPoints": 8,
  "actualEffortHours": 2.5,
  "progressPercentage": 100,
  "lastUpdated": "2026-07-08",
  "dependencies": ["NADAA-062", "NADAA-012"],
  "blockers": [],
  "verification": [
    "services/donation-service go test ./...",
    "services/donation-service go build .",
    "pnpm --filter @nadaa/shared-types typecheck",
    "pnpm --filter @nadaa/authority-dashboard typecheck",
    "pnpm --filter @nadaa/authority-dashboard build",
    "pnpm --filter @nadaa/citizen-web typecheck",
    "pnpm --filter @nadaa/citizen-web build",
    "pnpm smoke:donation with donation-service on 127.0.0.1:8100",
    "pnpm validate:dashboard",
    "pnpm validate:docs",
    "pnpm security:scan",
    "pnpm lint",
    "pnpm typecheck",
    "pnpm test",
    "pnpm build",
    "pnpm go:test",
    "pnpm audit --audit-level high",
    "pnpm exec prettier --check \"**/*.{md,json,ts,tsx,css,yml,yaml}\"",
    "git diff --check"
  ],
  "notes": "Donation and aid coordination UI integrations completed: authority-dashboard DonationPanel for catalog/aid-request/donor/pledge management, citizen-web DonorPortal for public pledge and donor registration, shared TypeScript contract alignment with backend response shapes, smoke-donation script, workspace script entry, dashboard tracking, and verification."
}
