{
  "client": "NADAA Ghana",
  "project": "Ghana Emergency Preparedness, Warning & Disaster Response Platform",
  "phase": "Phase 2",
  "sprint": "Sprint 12",
  "epic": "EPIC 6: Emergency Guidance, Shelters, And Recovery Support",
  "story": "Missing Persons Module",
  "jiraKey": "NADAA-132",
  "branchName": "feature/NADAA-132-missing-persons-module",
  "pullRequestUrl": "",
  "status": "Done",
  "assignedTeamMember": "Kimi",
  "estimatedEffortPoints": 13,
  "actualEffortHours": 3,
  "progressPercentage": 100,
  "lastUpdated": "2026-07-09",
  "dependencies": ["NADAA-030", "NADAA-090"],
  "blockers": [],
  "verification": [
    "services/missing-person-service go test ./...",
    "services/missing-person-service go build ./cmd/server",
    "pnpm go:lint",
    "pnpm --filter @nadaa/shared-types typecheck",
    "pnpm --filter @nadaa/citizen-web typecheck",
    "pnpm --filter @nadaa/authority-dashboard typecheck",
    "pnpm smoke:missing-person",
    "docker build -f services/missing-person-service/Dockerfile -t nadaa/missing-person-service:local .",
    "pnpm validate:dashboard",
    "pnpm validate:database",
    "pnpm validate:docs",
    "pnpm security:scan",
    "pnpm lint",
    "pnpm typecheck",
    "pnpm test",
    "pnpm build",
    "pnpm audit --audit-level high",
    "pnpm exec prettier --check .",
    "git diff --check"
  ],
  "notes": "services/missing-person-service converted to the NADAA-171/172 modular package structure (cmd/server + internal/config|models|store|utils|handlers) with graceful http.Server shutdown, CORS/security headers, private citizen intake, authority MFA/RBAC review, public visibility approvals, closure/reunification audit trail, approved public search, PostGIS migration, shared TypeScript contracts, citizen-web missing-person intake/search, authority-dashboard review/closure/audit panel, smoke/docs/dashboard updates, structured INFO/WARN/ERROR logs, Docker/CI wiring, and verification."
}
