{
  "client": "NADAA Ghana",
  "project": "Ghana Emergency Preparedness, Warning & Disaster Response Platform",
  "phase": "Phase 3",
  "sprint": "Sprint 14",
  "epic": "EPIC 15: Advanced AI, Simulation, And Resource Forecasting",
  "story": "Predictive Ambulance And Fire Station Positioning",
  "jiraKey": "NADAA-153",
  "branchName": "feature/NADAA-153-predictive-resource-positioning",
  "pullRequestUrl": "",
  "status": "Done",
  "assignedTeamMember": "Claude",
  "estimatedEffortPoints": 13,
  "actualEffortHours": 3,
  "progressPercentage": 100,
  "lastUpdated": "2026-07-10",
  "dependencies": ["NADAA-042", "NADAA-071", "NADAA-121"],
  "blockers": [],
  "verification": [
    "services/ml-service go test ./...",
    "services/ml-service go build ./cmd/server",
    "services/ml-service go vet ./...",
    "services/ml-service golangci-lint run ./...",
    "pnpm --filter @nadaa/shared-types typecheck",
    "pnpm --filter @nadaa/authority-dashboard typecheck",
    "pnpm --filter @nadaa/authority-dashboard build",
    "FORECAST_API_URL=http://127.0.0.1:18094/api/v1 pnpm smoke:predictive-positioning",
    "pnpm lint",
    "pnpm typecheck",
    "pnpm test",
    "pnpm build",
    "pnpm go:test",
    "pnpm go:vet",
    "pnpm validate:docs",
    "pnpm security:scan",
    "pnpm exec prettier --check",
    "git diff --check"
  ],
  "notes": "Extended services/ml-service with deterministic resource-demand forecasting (resource-forecast-rules-0.1.0) over the NADAA-070 flood-risk feature grid: GET /api/v1/forecasts (+region filter), GET /api/v1/forecasts/{region}, GET /api/v1/staging-suggestions (+agencyType filter), and POST /api/v1/forecasts/compare. Per-district demand is derived from historical reports, rainfall forecast, composite risk, and vulnerable population, with explainable factors and confidence. Staging suggestions match candidate bases to demand with recommended units, operational constraints, and coverage radius. Added authority-dashboard ResourcePositioningPanel (Leaflet staging map, forecast list, scenario comparison, confidence bars) with fixture fallback, shared TypeScript contracts banner, smoke script, and docs. All endpoints are read-only decision support with agency leadership retaining deployment authority; no automatic dispatch."
}
