{
  "client": "NADAA Ghana",
  "project": "Ghana Emergency Preparedness, Warning & Disaster Response Platform",
  "phase": "Phase 3",
  "sprint": "Sprint 15",
  "epic": "EPIC 15: Preparedness And Open Data",
  "story": "Public Disaster Education Campaigns",
  "jiraKey": "NADAA-161",
  "branchName": "feature/NADAA-161-public-campaigns",
  "pullRequestUrl": "",
  "status": "Done",
  "assignedTeamMember": "Kimi",
  "estimatedEffortPoints": 8,
  "actualEffortHours": 5,
  "progressPercentage": 100,
  "lastUpdated": "2026-07-10",
  "dependencies": ["NADAA-060", "NADAA-052"],
  "blockers": [],
  "verification": [
    "services/campaign-service go test ./...",
    "services/campaign-service go vet ./...",
    "services/campaign-service go build ./cmd/server",
    "pnpm --filter @nadaa/shared-types typecheck",
    "pnpm --filter @nadaa/authority-dashboard typecheck",
    "pnpm --filter @nadaa/citizen-web typecheck",
    "pnpm build",
    "node scripts/smoke-public-campaigns.mjs",
    "pnpm validate:docs",
    "pnpm lint",
    "pnpm security:scan",
    "git diff --check"
  ],
  "notes": "Public disaster education campaigns completed with dedicated services/campaign-service Go API (campaigns, templates, mocked metrics), authority-dashboard CampaignManagerPanel, citizen-web PublicCampaignsPanel, shared TypeScript contracts, smoke script, docs, dashboard record, and CI/Docker wiring. Publishing window validation prevents premature or stale campaigns."
}
