{
  "client": "NADAA Ghana",
  "project": "Ghana Emergency Preparedness, Warning & Disaster Response Platform",
  "phase": "Phase 3",
  "sprint": "Sprint 13/14",
  "epic": "EPIC 15: Advanced AI, Simulation, And Resource Forecasting",
  "story": "Real-Time Flood Simulation",
  "jiraKey": "NADAA-150",
  "branchName": "feature/NADAA-150-real-time-flood-simulation",
  "pullRequestUrl": "",
  "status": "Done",
  "assignedTeamMember": "Kimi",
  "estimatedEffortPoints": 21,
  "actualEffortHours": 4,
  "progressPercentage": 100,
  "lastUpdated": "2026-07-09",
  "dependencies": ["NADAA-070", "NADAA-072", "NADAA-081"],
  "blockers": [],
  "verification": [
    "services/ml-service go test ./...",
    "services/ml-service go build ./cmd/server",
    "pnpm --filter @nadaa/shared-types typecheck",
    "pnpm --filter @nadaa/authority-dashboard typecheck and build",
    "SIMULATION_API_URL=http://127.0.0.1:8094/api/v1 pnpm smoke:flood-simulation",
    "pnpm lint",
    "pnpm typecheck",
    "pnpm test",
    "pnpm build",
    "pnpm go:test",
    "pnpm go:lint",
    "pnpm go:vet",
    "pnpm validate:docs",
    "pnpm security:scan",
    "pnpm audit --audit-level high",
    "pnpm exec prettier --check",
    "git diff --check"
  ],
  "notes": "First-pass real-time flood simulation added to services/ml-service with POST/GET /api/v1/ml/flood/simulations, deterministic logistic scoring across the NADAA-070 feature grid, rainfall/water-level scenario overrides, versioned frames with GeoJSON polygons, assumptions and limitations. Authority-dashboard FloodSimulationPanel renders scenario form, frame slider, severity summary, and Leaflet overlay. Shared TypeScript contracts, smoke script, docs, and dashboard record added. Output is decision support only with human-review safety policy."
}
