{
  "client": "NADAA Ghana",
  "project": "Ghana Emergency Preparedness, Warning & Disaster Response Platform",
  "phase": "Phase 3",
  "sprint": "Sprint 13/14",
  "epic": "EPIC 16: Public Safety And Community Resilience",
  "story": "School Emergency Preparedness Module",
  "jiraKey": "NADAA-160",
  "branchName": "feature/NADAA-160-school-preparedness",
  "pullRequestUrl": "",
  "status": "Done",
  "assignedTeamMember": "Kimi",
  "estimatedEffortPoints": 13,
  "actualEffortHours": 3,
  "progressPercentage": 100,
  "lastUpdated": "2026-07-10",
  "dependencies": ["NADAA-060", "NADAA-062", "NADAA-021"],
  "blockers": [],
  "verification": [
    "services/school-service go test ./...",
    "services/school-service go build ./cmd/server",
    "pnpm --filter @nadaa/shared-types typecheck",
    "pnpm --filter @nadaa/authority-dashboard typecheck and build",
    "SCHOOL_API_URL=http://127.0.0.1:8097/api/v1 pnpm smoke:school-preparedness",
    "pnpm lint",
    "pnpm typecheck",
    "pnpm test",
    "pnpm build",
    "pnpm go:test",
    "pnpm go:lint",
    "pnpm go:vet",
    "pnpm validate:docs",
    "pnpm security:scan",
    "pnpm audit --audit-level high",
    "pnpm exec prettier --check",
    "git diff --check"
  ],
  "notes": "Added services/school-service Go API with school profiles, drill records, and readiness checks; district-scoped access for district officers and full access for system admins. Authority-dashboard SchoolPreparednessPanel with school list, district filter, profile detail, drill form, readiness checklist form, and Leaflet map with readiness indicators. Shared TypeScript contracts, smoke script, CI Docker matrix entry, README, api.md docs, and dashboard record added. Student population data is authority-scoped only."
}
